phase	type	id	status	title	owner	thread_url	done_criteria	notes
0	meta	T00	DONE	Reset task ledger for current branch work	OpenCode	local	Old historical rows removed; only active and near-term work remains	From this point on, tasks are added before work starts and updated as work progresses
1	build	T01	DONE	Finish Zig 0.16 migration for parts/cdp	OpenCode	local	`.#packages.x86_64-linux.chromium-cdp-tools` builds successfully with `zig-0_16-tooling`	`parts/cdp/cdp-bridge.zig` was adapted enough for `zig-0_16-tooling`; package now builds green via top-level flake
1	build	T02	IN_PROGRESS	Verify HQ and CDP Zig trees against the selected toolchain	OpenCode	local	`parts/chromedevtoolprotocol.zig` and `parts/hq.zig` have an agreed verification result under the branch toolchain	Current state: `parts/cdp` is green on `2915`; HQ/CDP `zig build test*` still need a compile-only or narrowed verification path because the full steps settle into a silent wait state
1	parts	T03	DONE	Keep parts-level wiring green while Zig migration proceeds	OpenCode	local	`nix build --no-link .#packages.x86_64-linux.hq-zig-src .#packages.x86_64-linux.chromedevtoolprotocol-zig-src .#checks.x86_64-linux.hq-zig-part-layout .#checks.x86_64-linux.chromedevtoolprotocol-zig-part-layout` passes	Confirmed green after the `parts/cdp` Zig 0.16 changes
2	infra	T04	BACKLOG	Hoist Zig toolchain packaging into parts/languages	OpenCode	local	`parts/languages/zig.nix` owns independent Zig toolchain builds and `parts/cdp` consumes them as dependencies	Temporary implementation lives in `parts/cdp/zig-0_16.nix`
0	branch	T05	DONE	Retarget branch flow from main lineage to dev lineage	OpenCode	local	`origin/dev` is fetched in the dev worktree, merged into this branch, and the PR base is updated to `dev`	`dev` worktree was fast-forwarded to `origin/dev`; merge conflicts were resolved in `parts/default.nix` and `parts/user/default.nix`
1	branch	T06	DONE	Resume Zig 0.16 migration on top of merged dev state	OpenCode	local	`T01` is revalidated after the dev merge and any new conflicts or blockers are reflected in the ledger	`T01` was revalidated green on top of merged `dev` state
1	toolchain	T07	CANCELLED	Pin the original Zig 0.16 dev snapshot	OpenCode	local	The branch uses `0.16.0-dev.2565+684032671` and verification is rerun against that exact toolchain	User chose to continue on the public `0.16.0-dev.2915+065c6e794` snapshot instead of waiting for an exact `2565` source artifact
1	consult	T08	DONE	Determine whether parts/cdp mjs tooling can consult ChatGPT about parts/hq.zig only	OpenCode	local	A clear yes/no answer is recorded for the mjs-only consultation route	Route is viable: `send-chatgpt.mjs` + `read-thread.mjs` cover text consultation for `parts/hq.zig`; the local blocker was only the default profile path assumption
1	consult	T09	BLOCKED	Open a new ChatGPT thread and send an hq.zig-only consultation prompt	OpenCode	local	A fresh ChatGPT thread receives the consultation request via `parts/cdp/*.mjs`, scoped only to `parts/hq.zig`	Port `9223` avoids the Cloudflare interstitial (`https://chatgpt.com/` is a normal composer page with `title = ChatGPT` and a visible textarea), but `send-chatgpt.mjs` still fails before send because `cdp-bridge version` exits with `error: Unexpected`
1	consult	T10	DONE	Capture parts/hq.zig diagnostics to seed the consultation prompt	OpenCode	local	The consultation prompt includes the current `parts/hq.zig` Zig 0.16 diagnostics and the desired end state	Prompt prepared in `/tmp/hq-zig-consult-prompt.txt`; current diagnosis is that `parts/hq.zig` likely needs test-side 0.16 drift review (`std.testing.io`, `std.testing.environ`) rather than a single compile error snapshot
1	diag	T11	DONE	Diagnose no-output timeouts in HQ/CDP Zig test steps	OpenCode	local	A concrete cause is identified for the silent `zig build test` / `zig build test-hq-*` timeouts on `0.16.0-dev.2915+065c6e794`	`timeout 60s` reproduces silent timeouts; short `strace` and thread inspection show both commands settling into futex waits inside `zig build` itself, with no spawned child test process visible at sample time
1	build	T12	IN_PROGRESS	Establish a compile-only verification path for HQ/CDP on Zig 0.16.2915	OpenCode	local	HQ and CDP module code can be checked under `2915` without relying on the currently hanging `zig build test*` steps	Initial attempt shows even direct compile-only on `parts/chromedevtoolprotocol.zig/src/root.zig` times out; next step is to narrow the hung import tree by compiling leaf modules
